0;0000001;google.com;NL Inloggen Voordat je verdergaat naar Google Zoeken Google gebruikt cookies en gegevens voor het volgende: Services leveren en onderhouden (zoals uitval bijhouden en beschermen tegen spam, fraude en misbruik). Betrokkenheid van doelgroepen en sitestatistieken meten om inzicht te krijgen in hoe onze services worden gebruikt. Als je akkoord gaat, gebruiken we cookies en gegevens ook voor het volgende: De kwaliteit van onze services verbeteren en nieuwe services ontwikkelen. Advertenties laten zien en de effectiviteit ervan meten. Gepersonaliseerde content laten zien (afhankelijk van je instellingen). Gepersonaliseerde of algemene advertenties laten zien (afhankelijk van je instellingen) op Google en het web. Voor niet-gepersonaliseerde content en advertenties kan wat je te zien krijgt, worden beïnvloed door factoren zoals de content die je op dat moment bekijkt en je locatie (voor advertenties wordt je algemene locatie gebruikt). Gepersonaliseerde content en advertenties kunnen ook worden gebaseerd op die factoren maar ook op je activiteit zoals Google-zoekopdrachten en de video's die je bekijkt op YouTube. Gepersonaliseerde content en advertenties zijn bijvoorbeeld relevantere resultaten en aanbevelingen, een aangepaste YouTube-homepage en advertenties die op je interesses zijn afgestemd. Klik op Aanpassen om de opties te bekijken, waaronder beheermogelijkheden om het gebruik van cookies voor personalisatie te weigeren, en informatie over browseropties waarmee je sommige of alle cookies kunt weigeren voor ander gebruik. Je kunt ook op elk moment naar g.co/privacytools gaan. Privacy · Voorwaarden Aanpassen Ik ga akkoord;True
1;0000002;netflix.com;Netflix en derden gebruiken cookies en soortgelijke technologieën op deze website om gegevens over je browse-activiteiten te verzamelen. Hiermee kunnen we je gebruik van de website analyseren, onze services personaliseren en onze online advertenties aanpassen. Wanneer je toestemming vereist is, kun je je keuzes accepteren, weigeren of personaliseren. Je kunt je voorkeuren ook altijd wijzigen door te klikken op Cookievoorkeuren in de voettekst van elke pagina. Netflix ondersteunt de Digital Advertising Alliance Principles. Lees meer over ons gebruik van cookies en gegevens. AccepterenWeigerenMijn keuzes personaliseren;True
2;0000002;netflix.com;Kijk op je tv. Kijk op smart-tv's, PlayStation, Xbox, Chromecast, Apple TV, blu-rayspelers en meer.;False
3;0000002;netflix.com;Download series die je offline wilt kijken. Sla je favorieten eenvoudig op zodat je altijd wat kunt kijken.;False
4;0000002;netflix.com;Kijk overal. Stream onbeperkt series en films op je telefoon, tablet, laptop en tv, zonder meer te betalen.;False
5;0000002;netflix.com;Maak profielen voor kids. Laat kids op avontuur gaan met hun favoriete personages in een omgeving die speciaal voor hen is gemaakt. Gratis bij je lidmaatschap.;False
6;0000003;youtube.com;Een bedrijf van Google NL INLOGGEN Voordat je verdergaat naar YouTube We gebruiken cookies en gegevens voor het volgende: Google-services leveren en onderhouden Uitval bijhouden en bescherming bieden tegen spam, fraude en misbruik Doelgroepbetrokkenheid en sitestatistieken meten om inzicht te krijgen in hoe onze services worden gebruikt en de kwaliteit van die services te verbeteren Als je Alles accepteren kiest, gebruiken we cookies en gegevens ook voor het volgende: Nieuwe services ontwikkelen en verbeteren Advertenties laten zien en de effectiviteit ervan meten Gepersonaliseerde content laten zien (afhankelijk van je instellingen) Gepersonaliseerde advertenties laten zien (afhankelijk van je instellingen) Als je Alles afwijzen kiest, gebruiken we cookies niet voor deze aanvullende doeleinden. Niet-gepersonaliseerde content en advertenties worden beïnvloed door factoren zoals de content die je op dat moment bekijkt en je locatie (voor advertenties wordt je algemene locatie gebruikt). Gepersonaliseerde content en advertenties kunnen bijvoorbeeld ook videoaanbevelingen, een aangepaste YouTube-homepage en op jou toegespitste advertenties omvatten die zijn gebaseerd op eerdere activiteit, zoals de video's die je bekijkt en de items waarnaar je zoekt op YouTube. We gebruiken cookies en gegevens ook om te zorgen dat de functionaliteit geschikt is voor je leeftijd, als dit relevant is. Selecteer Meer opties om meer informatie te bekijken, waaronder over hoe je je privacyinstellingen beheert. Je kunt ook altijd naar g.co/privacytools gaan. ALLES AFWIJZEN ALLES ACCEPTEREN MEER OPTIES Privacybeleid • Servicevoorwaarden;True
7;0000003;youtube.com;Home Ontdekken Abonnementen Bibliotheek Geschiedenis Log in om video's te liken, te reageren en je te abonneren. INLOGGEN HET BESTE VAN YOUTUBE Muziek Sport Games Films Nieuws Live 360°-video Browsen door kanalen MEER VAN YOUTUBE YouTube Premium Live Instellingen Meldingsgeschiedenis Hulp Feedback sturen OverPersAuteursrechtContactCreatorsAdverterenOntwikkelaars VoorwaardenPrivacyBeleid en veiligheidZo werkt YouTubeNieuwe functies testen © 2022 Google LLC;False
8;0000004;facebook.com;Het gebruik van cookies van Facebook toestaan in deze browser? We gebruiken cookies en vergelijkbare technologieën om te helpen met het volgende: Inhoud in Facebook-producten verstrekken en verbeteren Een veiligere ervaring bieden door gegevens te gebruiken die we ontvangen via cookies op en buiten Facebook Facebook-producten bieden aan en verbeteren voor mensen die een account hebben We gebruiken tools van andere bedrijven op Facebook voor advertentie- en metingsservices buiten Facebook-producten, voor analysedoeleinden, om bepaalde functies aan te bieden en om onze services voor jou te verbeteren. Deze bedrijven maken ook gebruik van cookies. Je kunt het gebruik toestaan van alle cookies of alleen essentiële cookies, of je kunt hieronder meer opties kiezen. In ons cookiebeleid vind je meer informatie over cookies en hoe we ze gebruiken, en je kunt daar op elk gewenst moment je keuze bekijken of wijzigen. Essentiële cookies Deze cookies zijn vereist voor het gebruik van Meta-producten. Ze zijn noodzakelijk om deze sites te laten werken zoals bedoeld. Optionele cookies Cookies van andere bedrijven We gebruiken tools van andere bedrijven voor advertentie- en metingsservices buiten Facebook-producten, voor analysedoeleinden, om bepaalde functies aan te bieden en om onze services voor jou te verbeteren. Deze bedrijven maken ook gebruik van cookies. Meer informatie Andere manieren waarop je je gegevens kunt beheren Beheeropties in je Facebook-account Meer informatie over online advertenties Cookies beheren via browserinstellingen Alleen essentiële cookies toestaan Essentiële en optionele cookies toestaan;True
9;0000005;microsoft.com;Nous utilisons des cookies facultatifs pour améliorer votre expérience sur nos sites Web, par exemple en vous permettant de vous connecter aux réseaux sociaux, et pour afficher de la publicité personnalisée en fonction de votre activités en ligne. Si vous refusez les cookies facultatifs, seuls les cookies nécessaires pour vous fournir les services seront utilisés. Vous pouvez modifier votre sélection en cliquant sur « Gérer les cookies » au bas de la page. Déclaration de confidentialité Cookies tiers Accepter Refuser Gérer les cookies;True
10;0000006;twitter.com;Did someone say … cookies? Twitter and its partners use cookies to provide you with a better, safer and faster service and to support our business. Some cookies are necessary to use our services, improve our services, and make sure they work properly. Show more about your choices. Accept all cookies Refuse non-essential cookies;True
11;0000007;instagram.com;Afrikaans Čeština Dansk Deutsch Ελληνικά English English (UK) Español (España) Español Suomi Français Bahasa Indonesia Italiano 日本語 한국어 Bahasa Melayu Norsk Nederlands Polski Português (Brasil) Português (Portugal) Русский Svenska ภาษาไทย Filipino Türkçe 中文(简体) 中文(台灣) বাংলা ગુજરાતી हिन्दी Hrvatski Magyar ಕನ್ನಡ മലയാളം मराठी नेपाली ਪੰਜਾਬੀ සිංහල Slovenčina தமிழ் తెలుగు Tiếng Việt 中文(香港) Български Français (Canada) Română Српски Українська Het gebruik van cookies van Instagram toestaan in deze browser? We gebruiken cookies en vergelijkbare technologieën om te helpen met het volgende: Inhoud in Facebook-producten aanbieden en verbeteren Een veiligere ervaring bieden door gegevens te gebruiken die we ontvangen via cookies op en buiten Instagram Facebook-producten aanbieden en verbeteren voor mensen die een account hebben We gebruiken tools van andere bedrijven op Instagram voor advertentie- en metingsservices buiten Facebook-producten, voor analysedoeleinden, en voor het aanbieden van bepaalde functies en verbeteren van onze services voor jou. Deze bedrijven gebruiken ook cookies. Je kunt het gebruik toestaan van alle cookies of alleen essentiële cookies, of je kunt hieronder meer opties kiezen. In ons Cookiebeleid vind je meer informatie over cookies en hoe we ze gebruiken, en je kunt daar op elk gewenst moment je keuze bekijken of wijzigen. Essentiële cookies Deze cookies zijn vereist voor het gebruik van Facebook-producten. Ze zijn noodzakelijk om deze sites te laten werken zoals bedoeld. Optionele cookies Cookies van andere bedrijven We gebruiken tools van andere bedrijven voor advertentie- en metingsservices buiten Facebook-producten, voor analysedoeleinden, om bepaalde functies aan te bieden en om onze services voor jou te verbeteren. Deze bedrijven maken ook gebruik van cookies. Meer informatie Andere manieren waarop je je gegevens kunt beheren Instellingen in je Instagram-account Meer informatie over online adverteren Cookies beheren via browserinstellingen Alleen essentiële cookies toestaan Essentiële en optionele cookies toestaan;True
12;0000008;linkedin.com;Wij en derden, zoals onze klanten, partners en dienstverleners, gebruiken cookies en vergelijkbare technologieën (‘cookies’) om onze Diensten te leveren en te beveiligen, hun prestaties te begrijpen en te verbeteren en relevante advertenties (waaronder vacatureadvertenties) binnen en buiten LinkedIn weer te geven. Zie ons cookiebeleid voor meer informatie. Selecteer Cookies accepteren om toestemming te geven voor dit gebruik of Voorkeuren beheren om uw cookiekeuzes te maken. U kunt op elk gewenst moment uw cookiekeuzes wijzigen en uw toestemming in uw instellingen intrekken. Voorkeuren beheren Cookies accepteren;True
13;0000009;apple.com;Kies een ander land of andere regio als je de content voor jouw locatie wilt zien en online wilt shoppen. België Ga door;False
14;0000009;apple.com;Apple Store Mac iPad iPhone Watch AirPods TV & Home Only on Apple Accessories Support Shopping Bag;False
15;0000009;apple.com;Donate to support families affected by the war in Ukraine;False
16;0000009;apple.com;  Apple Worldwide Developers Conference 2022 The Worldwide Developers Conference is coming. Join us online June 6–10. Learn more;False
17;0000009;apple.com;  The new iPhone SE Love the power. Love the price. Learn more Buy;False
18;0000012;wikipedia.org;Afrikaans Polski Slovenčina العربية Asturianu Azərbaycanca Български Bân-lâm-gú / Hō-ló-oē বাংলা Беларуская Català Čeština Cymraeg Dansk Deutsch Eesti Ελληνικά English Español Esperanto Euskara فارسی Français Galego 한국어 Հայերեն हिन्दी Hrvatski Bahasa Indonesia Italiano עברית ქართული Latina Latviešu Lietuvių Magyar Македонски مصرى Bahasa Melayu Bahaso Minangkabau Nederlands 日本語 Norsk (bokmål) Norsk (nynorsk) Нохчийн Oʻzbekcha / Ўзбекча Português Қазақша / Qazaqşa / قازاقشا Română Русский Simple English Sinugboanong Binisaya Slovenščina Српски / Srpski Srpskohrvatski / Српскохрватски Suomi Svenska தமிழ் Татарча / Tatarça ภาษาไทย Тоҷикӣ تۆرکجه Türkçe Українська اردو Tiếng Việt Volapük Winaray 粵語 中文 မြန်မာဘာသာ;False
19;0000015;googletagmanager.com;400. That’s an error. Your client has issued a malformed or illegal request. That’s all we know.;False
20;0000016;wordpress.org;Skip to content About WordPress Search Log In Register Plugins Themes Patterns Learn Support News About Get Involved Showcase Mobile Hosting Openverse Get WordPress Meet WordPress WordPress is open source software you can use to create a beautiful website, blog, or app. WordPress is also available in Nederlands (België). Beautiful designs, powerful features, and the freedom to build anything you want. WordPress is both free and priceless at the same time. Trusted by the Best 43% of the web uses WordPress, from hobby blogs to the biggest news sites online. Discover more sites built with WordPress Powerful Features Limitless possibilities. What will you create? Customizable Designs SEO Friendly Responsive Mobile Sites High Performance Manage on the Go High Security Powerful Media Management Easy and Accessible Extend WordPress with over 55,000 plugins to help your website meet your needs. Add an online store, galleries, mailing lists, forums, analytics, and much more. Community Hundreds of thousands of developers, content creators, and site owners gather at monthly meetups in 817 cities worldwide. Find a local WordPress community Get Started with WordPress Over 60 million people have chosen WordPress to power the place on the web they call “home” — join the family. Get WordPress News From Our Blog WordPress 6.0 Release Candidate 2 (RC2) Now Available for Testing WordPress 6.0 Release Candidate 2 is now available for testing! You can download and help test RC2 in three ways. You can also help translate WordPress to 100+ languages. It’s Easy As… Find a trusted web host and maybe support WordPress at the same time. Download & install WordPress with our famous 5-minute installation. Publishing has never been easier. Spend some time reading our documentation, get to know WordPress better every day and start helping others, too. WordPress Swag WordPress Users … and hundreds more About News Hosting Donate Support Developers Get Involved Learn Showcase Plugins Themes Patterns WordCamp WordPress.TV BuddyPress bbPress WordPress.com Matt Privacy Public Code WordPress.org Visit our Facebook page Visit our Twitter account;False
21;0000017;amazon.com;We're showing you items that ship to BE. To see items that ship to a different country, change your delivery address. Don't Change Change Address;False
22;0000017;amazon.com;Today's Deals Customer Service Registry Gift Cards Sell;False
23;0000017;amazon.com;Deliver to Belgium All All Departments Arts & Crafts Automotive Baby Beauty & Personal Care Books Boys' Fashion Computers Deals Digital Music Electronics Girls' Fashion Health & Household Home & Kitchen Industrial & Scientific Kindle Store Luggage Men's Fashion Movies & TV Music, CDs & Vinyl Pet Supplies Prime Video Software Sports & Outdoors Tools & Home Improvement Toys & Games Video Games Women's Fashion Hello, Sign in Account & Lists Returns & Orders 0 Cart;False
24;0000018;live.com;Outlook Verbinden. Organiseren. De klus klaren. Gratis e-mail en agenda in Outlook Alles wat u nodig hebt om u van uw meest productieve en verbonden kant te laten zien - thuis, onderweg, en alles daartussen. Gratis account maken Microsoft Premium-versie uitproberen Aanmelden;False
25;0000019;yahoo.com;guce Uw gegevens. Uw ervaring. Yahoo maakt deel uit van de Yahoo-merkenfamilie. Door op "Alles accepteren" te klikken ga je ermee akkoord dat Yahoo en onze partners informatie op je apparaat opslaan en/of openen door middel van cookies en vergelijkbare technologieën en dat ze je persoonsgegevens verwerken om gepersonaliseerde advertenties en inhoud te tonen, advertenties en inhoud te meten, doelgroepinzichten te verkrijgen en producten te ontwikkelen. Uw persoonsgegevens die kunnen worden gebruikt Informatie over uw apparaat en internetverbinding, waaronder uw IP-adres Surf- en zoekactiviteit terwijl u gebruik maakt van websites en apps van Yahoo Exacte locatie Je kunt 'Instellingen beheren' selecteren voor meer informatie en om je keuzes te beheren. Je kunt je keuzes op elk moment wijzigen door naar Je privacy-instellingen te gaan. Lees ons Privacybeleid en Cookiebeleid voor meer informatie over hoe we je gegevens gebruiken. Klik hier voor meer informatie over onze partners. Alles accepteren Instellingen beheren;True
26;0000021;youtu.be;Een bedrijf van Google NL INLOGGEN Voordat je verdergaat naar YouTube We gebruiken cookies en gegevens voor het volgende: Google-services leveren en onderhouden Uitval bijhouden en bescherming bieden tegen spam, fraude en misbruik Doelgroepbetrokkenheid en sitestatistieken meten om inzicht te krijgen in hoe onze services worden gebruikt en de kwaliteit van die services te verbeteren Als je Alles accepteren kiest, gebruiken we cookies en gegevens ook voor het volgende: Nieuwe services ontwikkelen en verbeteren Advertenties laten zien en de effectiviteit ervan meten Gepersonaliseerde content laten zien (afhankelijk van je instellingen) Gepersonaliseerde advertenties laten zien (afhankelijk van je instellingen) Als je Alles afwijzen kiest, gebruiken we cookies niet voor deze aanvullende doeleinden. Niet-gepersonaliseerde content en advertenties worden beïnvloed door factoren zoals de content die je op dat moment bekijkt en je locatie (voor advertenties wordt je algemene locatie gebruikt). Gepersonaliseerde content en advertenties kunnen bijvoorbeeld ook videoaanbevelingen, een aangepaste YouTube-homepage en op jou toegespitste advertenties omvatten die zijn gebaseerd op eerdere activiteit, zoals de video's die je bekijkt en de items waarnaar je zoekt op YouTube. We gebruiken cookies en gegevens ook om te zorgen dat de functionaliteit geschikt is voor je leeftijd, als dit relevant is. Selecteer Meer opties om meer informatie te bekijken, waaronder over hoe je je privacyinstellingen beheert. Je kunt ook altijd naar g.co/privacytools gaan. ALLES AFWIJZEN ALLES ACCEPTEREN MEER OPTIES Privacybeleid • Servicevoorwaarden;True
27;0000021;youtu.be;Home Ontdekken Abonnementen Bibliotheek Geschiedenis Log in om video's te liken, te reageren en je te abonneren. INLOGGEN HET BESTE VAN YOUTUBE Muziek Sport Games Films Nieuws Live 360°-video Browsen door kanalen MEER VAN YOUTUBE YouTube Premium Live Instellingen Meldingsgeschiedenis Hulp Feedback sturen OverPersAuteursrechtContactCreatorsAdverterenOntwikkelaars VoorwaardenPrivacyBeleid en veiligheidZo werkt YouTubeNieuwe functies testen © 2022 Google LLC;False
28;0000024;adobe.com;Bepaal zelf. Adobe en zijn leveranciers gebruiken cookies en vergelijkbare technologieën om je een betere ervaring te geven en om je interacties met onze websites, producten en services te meten. We gebruiken ze ook om je relevantere zoekresultaten en relevantere advertenties op deze en andere sites te geven. Als je dat prima vindt, klik je op "Enable all" (Alles inschakelen). Om het delen van gegevens te beperken en onze leveranciers te bekijken, klik je op "Customize" (Aanpassen). Je kunt je instellingen altijd wijzigen. Aanpassen Alles inschakelen;True
29;0000024;adobe.com;Consultez-vous le site Adobe.com depuis un autre pays que les États-Unis ? Visitez votre site régional pour découvrir les tarifs appropriés, les promotions et les événements. Bezoek je Adobe.com van buiten de Verenigde Staten? Bezoek je regionale site voor relevantere prijzen, promoties en evenementen. Are you visiting Adobe.com from outside the US? Visit your regional site for more relevant pricing, promotions and events. Continue to Belgium Aller sur le site belge Ga naar België Continue to United States;False
30;0000025;vimeo.com;Solutions Features Resources Watch Pricing Contact sales Log in Join New video;False
31;0000026;windowsupdate.com;We use optional cookies to improve your experience on our websites, such as through social media connections, and to display personalized advertising based on your online activity. If you reject optional cookies, only cookies necessary to provide you the services will be used. You may change your selection by clicking “Manage Cookies” at the bottom of the page. Privacy Statement Third-Party Cookies Accept Reject Manage cookies;True
32;0000027;office.com;We gebruiken optionele cookies om je ervaring op onze websites te verbeteren, zoals via verbindingen op social media, en om gepersonaliseerde advertenties weer te geven op basis van je online activiteiten. Als je optionele cookies afwijst, worden alleen cookies gebruikt die nodig zijn om je de services te kunnen leveren. Je kunt je keus wijzigen door onderaan de pagina op 'Cookies beheren' te klikken.Privacyverklaring Cookies van derden Accepteren Weigeren Cookies beheren;True
33;0000030;bing.com;Microsoft en onze externe leveranciers gebruiken cookies en vergelijkbare technologieën om onze services en advertenties te leveren, te onderhouden en te verbeteren. Als u akkoord gaat, gebruiken we deze gegevens voor persoonlijke advertenties en bijbehorende analyses. Je kunt 'Accepteren' selecteren om toestemming te geven voor deze toepassingen of op 'Meer opties' klikken om je opties te bekijken. Je kunt je selectie wijzigen onder ‘Cookievoorkeuren beheren’ onderaan deze pagina.  Privacyverklaring Akkoord Meer opties;True
34;0000030;bing.com;AfbeeldingenVideo'sVertalen FrançaisAanmeldenRewards;False
35;0000031;amazonaws.com;Select your cookie preferences We use cookies and similar tools to enhance your experience, provide our services, deliver relevant advertising, and make improvements. Approved third parties also use these tools to help us deliver advertising and provide certain site features. Customize Accept all;True
36;0000032;goo.gl;Deze site gebruikt cookies van Google om services te leveren en verkeer te analyseren. Je IP-adres en user-agent worden met Google gedeeld, samen met prestatie- en beveiligingsstatistieken om servicekwaliteit te garanderen, gebruiksstatistieken te genereren, misbruik te detecteren en maatregelen te treffen.MEER INFORMATIEOK;True
37;0000032;goo.gl;search Return to Google Developers Latest Get Inspired Announcements Events Resources;False
38;0000033;github.com;Product Team Enterprise Explore Marketplace Pricing Sign in Sign up;False
39;0000034;wordpress.com;Wij en onze partners verwerken je persoonlijke gegevens (zoals browsegegevens, IP-adressen, cookie-informatie en andere unieke identificatiecodes) op basis van je toestemming en/of onze rechtmatige belangen voor het optimaliseren van onze website, marketingactiviteiten en je gebruikerservaring. Aanpassen Alles accepteren;True
40;0000034;wordpress.com;AAN DE SLAG Registreren Inloggen Abonnementen en prijzen PRODUCTEN WordPress Hosting Domeinnamen Websitebouwer Maak een blog aan Professionele e-mail P2: WordPress voor teams Enterprise MOGELIJKHEDEN Overzicht WordPress-thema’s WordPress-plugins Google Apps HULPMIDDELEN WordPress.com Ondersteuning Nieuws Tips bouwen van websites Bedrijfsnaamgenerator Logo maker Dagelijkse webinars WordPress cursussen;False
41;0000034;wordpress.com;WordPress.com Producten Mogelijkheden Hulpmiddelen Abonnementen en prijzen Inloggen Aan de slag;False
42;0000037;reddit.com;We use cookies on our websites for a number of purposes, including analytics and performance, functionality and advertising. Learn more about Reddit’s use of cookies. Reject non-essential Accept all;True
43;0000037;reddit.com;Press J to jump to the feed. Press question mark to learn the rest of the keyboard shortcuts Search all of Reddit Log In Sign Up User account menu;False
44;0000037;reddit.com;Security Deal UK strikes security deal with Finland and Sweden, pledging to come to their defence in the event of an attack.;False
45;0000037;reddit.com;Inflation Two-thirds of Americans live paycheck to paycheck as inflation continues to climb r/politics and more;False
46;0000037;reddit.com;Florida Florida judge says DeSantis' redistricting map is unconstitutional r/news and more;False
47;0000038;bit.ly;Brand Your Links with a Custom Domain Custom domains replace the "bit.ly" in your short links with the name of your choosing, so you can take total control of your content. Get Started Read Why Every Business Needs Branded Links;False
48;0000038;bit.ly;We use cookies to make interactions with our website and services easy and meaningful, and better understand how they are used and to tailor advertising. You can read more and make your cookie choices here. By continuing to use this site you are giving us your consent to do this. Learn More GOT IT;True
49;0000038;bit.ly;Why Bitly? Solutions Features Pricing Resources Log in Sign up Free Get a Quote;False
50;0000039;zoom.us;Zoom uses cookies and similar technologies as strictly necessary to make our site work. We and our partners would also like to set additional cookies to analyze your use of our site, to personalize and enhance your visit to our site and to show you more relevant content and advertising. These will be set only if you accept.  You can always review and change your cookie preferences through our cookie settings page. For more information, please read our Privacy Statement. DECLINE COOKIES ACCEPT COOKIES COOKIES SETTINGS;True
51;0000040;blogspot.com;.st0 { fill: url(#gradientone). } .st1 { fill: #FFFFFF. } .st2 { fill: url(#gradienttwo). } INLOGGEN;False
52;0000040;blogspot.com;Zet je gedachten online zoals jij dat wilt Maak makkelijk een unieke, prachtige blog. JE EIGEN BLOG MAKEN;False
