279;0000211;opendns.com;Met cookies kunnen we uw gebruik van onze website optimaliseren. We gebruiken ook cookies van derden voor advertentie- en analysedoeleinden. Lees onze Privacyverklaring en Cookiekennisgeving voor meer informatie. Nee, cookie-instellingen bewerken Weigeren Accepteren;True
280;0000211;opendns.com;ENTERPRISE MSP & PARTNERS CONSUMER ABOUT US SEARCH SUPPORT LOGIN;False
281;0000211;opendns.com;OpenDNS is now part of Cisco Learn More About Cisco;False
282;0000212;nginx.com;Cookie preferences Accept cookies for analytics, social media, and advertising, or learn more and adjust your preferences. These cookies are on by default for visitors outside the UK and EEA. Privacy Notice. Accept;True
283;0000214;unsplash.com;Editorial Featured Digital Nomad Current Events Wallpapers 3D Renders Textures & Patterns Experimental Architecture Nature Business & Work Fashion Film Food & Drink Health & Wellness People Interiors Street Photography Travel Animals Spirituality Arts & Culture History Athletics;False
284;0000214;unsplash.com;Unsplash is now supported in multiple languages. You can switch back to English at any time. More languages coming soon. Learn more Got it;False
285;0000215;scorecardresearch.com;English | Español | Nederlands | Svenska | Português do Brasil  Norsk | 中文 | 日本語 | Italiano | Deutsch | Français | Suomi | Home About Preferences Contact Us Privacy Policy Terms of Service Principles   Welcome ScorecardResearch, a service of Full Circle Studies, Inc., is part of the Comscore, Inc. market research community, a leading global market research effort that studies and reports on Internet trends and behavior. ScorecardResearch conducts research by collecting Internet web browsing data and then uses that data to help show how people use the Internet, what they like about it, and what they don’t.  ScorecardResearch collects data through from two main sources: surveys and web tagging. For our surveys, we invite people on the Internet to provide us with anonymous demographic and Internet usage information that we can use to refine our reporting. These surveys are always voluntary, and are never used to collect personal information. For web tagging, participating websites agree to deploy a special code throughout their sites. Again, no personally identifiable information is ever transmitted by, or linked to, the web tags.   Learn more about ScorecardResearch and our market research programs.  © 2022 ScorecardResearch, All Rights Reserved;False
286;0000218;wired.com;We Care About Your Privacy We and our partners store and/or access information on a device, such as unique IDs in cookies to process personal data. You may accept or manage your choices by clicking below or at any time in the privacy policy page. These choices will be signaled to our partners and will not affect browsing data. We and our partners process data to provide: Use precise geolocation data. Actively scan device characteristics for identification. Store and/or access information on a device. Personalised ads and content, ad and content measurement, audience insights and product development. List of Partners (vendors) I Accept Show Purposes;True
287;0000218;wired.com;OPEN NAVIGATION MENU BACKCHANNEL BUSINESS CULTURE GEAR IDEAS SCIENCE SECURITY SIGN IN SUBSCRIBE SEARCH;False
288;0000219;amazon.de;Wählen Sie Ihre Cookie-Einstellungen Wir verwenden Cookies und ähnliche Tools, die erforderlich sind, um Ihnen Einkäufe zu ermöglichen, Ihr Einkaufserlebnis zu verbessern und unsere Dienste bereitzustellen. Dies wird auch in unseren Cookie-Bestimmungen beschrieben. Wir verwenden diese Cookies auch, um nachzuvollziehen, wie Kunden unsere Dienste nutzen (z. B. durch Messung der Websiteaufrufe), damit wir Verbesserungen vornehmen können. Wenn Sie damit einverstanden sind, verwenden wir auch Cookies, um Ihr Einkaufserlebnis in den Stores zu ergänzen. Dies wird auch in unseren Cookie-Bestimmungen beschrieben. Dies beinhaltet die Verwendung von Cookies von Erst- und Drittanbietern, die Standardgeräteinformationen wie eine eindeutige Kennzeichnung speichern oder darauf zugreifen. Drittanbieter verwenden Cookies, um personalisierte Anzeigen zu schalten, deren Wirksamkeit zu messen, Erkenntnisse über Zielgruppen zu generieren und Produkte zu entwickeln und zu verbessern. Klicken Sie auf „Cookies anpassen“, um diese Cookies abzulehnen, detailliertere Einstellungen vorzunehmen oder mehr zu erfahren. Sie können Ihre Auswahl jederzeit ändern, indem Sie die Cookie-Einstellungen, wie in den Cookie-Bestimmungen beschrieben, aufrufen. Um mehr darüber zu erfahren, wie und zu welchen Zwecken Amazon personenbezogene Daten (z. B. den Bestellverlauf im Amazon Store) verwendet, lesen Sie bitte unsere Datenschutzerklärung. Cookies akzeptieren Cookie-Einstellungen anpassen;True
289;0000219;amazon.de;Bestseller Amazon Basics Angebote Kundenservice Prime Video Neuerscheinungen Prime Musik Mode Audible Bücher Elektronik & Foto Games Küche, Haushalt & Wohnen;False
290;0000219;amazon.de;.de Liefern nach Belgien Alle Alle Kategorien Alexa Skills Amazon Geräte Amazon Global Store Amazon Warehouse Apps & Spiele Audible Hörbücher Auto & Motorrad Baby Baumarkt Beauty Bekleidung Beleuchtung Bücher Bürobedarf & Schreibwaren Computer & Zubehör Drogerie & Körperpflege DVD & Blu-ray Elektro-Großgeräte Elektronik & Foto Fashion Games Garten Geschenkgutscheine Gewerbe, Industrie & Wissenschaft Handmade Haustier Home & Business Services Kamera & Foto Kindle-Shop Klassik Koffer, Rucksäcke & Taschen Küche, Haushalt & Wohnen Lebensmittel & Getränke Musik-CDs & Vinyl Musik-Downloads Musikinstrumente & DJ-Equipment Premium Beauty Prime Video Schmuck Schuhe & Handtaschen Software Spar-Abo Spielzeug Sport & Freizeit Uhren Zeitschriften Hallo, Anmelden Konto und Listen Warenrücksendungen und Bestellungen 0 Einkaufswagen;False
291;0000220;zendesk.com;We use cookies to provide visitors with the best possible experience on our website. These include analytics, functionality, and targeting cookies, which may also be used in our marketing efforts. Click the 'Accept All' button to agree to the use of cookies or click 'Cookie Settings' to manage your preferences. To opt out of non-essential cookies, click 'Reject All'.Cookie policy Cookie settings Reject all Accept all;True
292;0000221;espn.com;We use cookies and various web tracking technologies to personalize content and ads, to provide social media features, and to analyse our traffic. We also share information about your use of our site with our social media, advertising, and analytics partners. You may read more about any of the purposes or vendors that we use by clicking ‘Show Purposes’ and exercise your right to consent or object to the processing of your personal data on the basis of legitimate interest. This preference center is accessible at any time through the ‘Manage Privacy Preferences’ link located on every page. We work in coordination with an industry framework which will signal your preferences to our participating vendors. For additional information, please visit our Privacy Policy. We and our partners process data to provide: Store and/or access information on a device. Precise geolocation data, and identification through device scanning. Personalised ads and content, ad and content measurement, audience insights and product development. List of Partners (vendors) I Accept Show Purposes Continue without Accepting;True
293;0000223;dailymotion.com;Doorgaan zonder accepteren We respecteren uw privacy Dailymotion en diens partners gebruiken los van elkaar of gezamenlijk 'cookies' voor het opslaan en/of openen van informatie op uw apparaat, zoals uw IP-adres, en kunnen deze informatie gebruiken voor de volgende doeleinden: gepersonaliseerde advertenties en content, advertentie- en contentmetingen, doelgroepinzichten, het ontwikkelen en verbeteren van producten, het regelen van beveiliging, de preventie van fraude, foutoplossing en technische levering van advertenties en content. Onze partners maken mogelijk gebruik van speciale functies, zoals nauwkeurige geografische locatiegegevens en identificatie via het scannen van apparaten. Sommige partners maken gebruik van hun legitiem belang om persoonlijke gegevens te verwerken. Bekijk onze partnerlijsten om dit te weigeren. Uw keuzes op deze website zijn van toepassing op alle diensten van Dailymotion en kunnen op elk gewenst moment worden gewijzigd via 'Cookies beheren'. Indien u geen toestemming geeft, kunt u alsnog gebruikmaken van onze diensten en worden advertenties alsnog getoond. Dailymotion gebruikt mogelijk ook cookies waarmee u content op sociale media kunt delen. Voor ons gebruik van 'essentiële cookies' is uw toestemming niet vereist. We maken gebruik van ons legitiem belang voor de verwerking van uw persoonlijke gegevens voor standaard advertenties, gepersonaliseerde content, advertentie- en contentmetingen, doelgroepinzichten en productontwikkeling. We vragen uw toestemming voor de overige doeleinden. Dailymotion voegt mogelijk door cookies verzamelde gegevens samen met uw persoonlijke gegevens die door u of over u zijn verkregen. Deze gegevens worden gebruikt voor de bovenstaande doeleinden. Dailymotion deelt mogelijk uw persoonlijke gegevens met onze gelieerde partners. Door op 'Accepteren' te klikken geeft u toestemming voor de gegevensverzameling en het gebruik en het delen hiervan zoals dat hierboven staat beschreven. Klik hieronder op 'Personaliseren' voor meer informatie over deze verwerking of om de verwerking van uw gegevens door Dailymotion of diens partners voor alle of sommige doeleinden te weigeren. Als u op 'Doorgaan zonder accepteren' klikt, geeft u geen toestemming. Lees ons privacybeleid en cookiebeleid voor meer informatie over het gebruik van uw gegevens door Dailymotion en diens partners. Scroll om meer te lezen Aanpassen Accepteren;True
294;0000225;line.me;Life on LINE LINE—always at your side. Download Scroll;False
295;0000226;cpanel.com;This website uses cookies cPanel and other members of the WebPros group may store and process the data I provide for the purpose of delivering personalized marketing content such as newsletters and individual offers according to the cPanel Privacy Policy [https://cpanel.net/privacy-policy/]. Tailored offerings may be based on additional information like usage and behavior data (Profiling). I can revoke this consent at any time by following the opt-out option in any received mail or by sending an email to privacy@cpanel.net. Allow selection Allow all Necessary Preferences Statistics Marketing Show details;True
296;0000227;freepik.com;We Care About Your Privacy We and our partners store and/or access information on a device, such as unique IDs in cookies to process personal data. You may accept or manage your choices by clicking below, including your right to object where legitimate interest is used, or at any time in the privacy policy page. These choices will be signaled to our partners and will not affect browsing data.More information in our Cookie Policy We and our partners process data to provide: Use precise geolocation data. Actively scan device characteristics for identification. Store and/or access information on a device. Personalised ads and content, ad and content measurement, audience insights and product development. List of Partners (vendors) I Accept Show Purposes;True
297;0000229;techcrunch.com;techcrunch Your data. Your experience. TechCrunch is part of the Yahoo family of brands. By clicking "Accept all" you agree that Yahoo and our partners will store and/or access information on your device through the use of cookies and similar technologies and process your personal data, to display personalised ads and content, for ad and content measurement, audience insights and product development. Your personal data that may be used Information about your device and internet connection, including your IP address Browsing and search activity while using Yahoo websites and apps Precise location You can select 'Manage settings' for more information and to manage your choices. You can change your choices at any time by visiting Your Privacy Controls. Find out more about how we use your information in our Privacy Policy and Cookie Policy. Click here to find out more about our partners. Accept all Manage settings;True
298;0000231;indiatimes.com;Accept the updated Privacy & Cookie Policy The indiatimes.com privacy policy has been updated to align with the new data regulations in European Union. Please review and accept these changes below to continue using the website. We use cookies to ensure the best experience for you on our website. I agree to see customized ads that are tailor-made to my preferences Agree & continue;True
299;0000231;indiatimes.com;TECHNOLOGY Most Marine Life Would Be Extinct Before 2300 Due To Greenhouse Gas Emissions;False
300;0000232;huffingtonpost.com;We value your privacy We and our partners store and/or access information on a device, such as cookies and process personal data, such as unique identifiers and standard information sent by a device for personalised ads and content, ad and content measurement, and audience insights, as well as to develop and improve products. With your permission we and our partners may use precise geolocation data and identification through device scanning. You may click to consent to our and our partners’ processing as described above. Alternatively you may click to refuse to consent or access more detailed information and change your preferences before consenting. Please note that some processing of your personal data may not require your consent, but you have a right to object to such processing. Your preferences will apply to a group of websites. You can change your preferences at any time by returning to this site or visit our privacy policy. DISAGREE & EXIT MORE OPTIONS AGREE & EXIT;True
301;0000235;goodreads.com;Discover & read more Continue with Facebook Continue with Amazon Continue with Apple Sign up with email By creating an account, you agree to the Goodreads Terms of Service and Privacy Policy. Already a member? Sign In;False
302;0000236;telegram.org;NL Twitter Home FAQ Apps API Protocol Recent nieuws 7 dec. Beschermde inhoud, verwijderen op datum, anoniem reageren en meer 19 sep. Chatthema's, interactieve emoji en meer 31 aug. Livestreams, flexibel doorsturen en meer een nieuw communicatietijdperk Telegram voor Android Telegram voor iPhone / iPad Telegram voor PC / Linux Telegram voor macOS Recent nieuws Beschermde inhoud, verwijderen op datum, anoniem reageren en meer Met deze update brengen we je mogelijkheden om te voorkomen dat anderen content opslaan van groepen en kanalen, de mogelijkheid om berichten… 7 dec. 2021 Chatthema's, interactieve emoji, leesbevestigingen in groepen en livestreamopname Met de update van vandaag kun je verschillende thema's instellen voor individuele chats, je… 19 sep. 2021 Waarom Telegram? Eenvoudig Telegram is zo eenvoudig dat je al weet hoe je het moet gebruiken. Privé Telegram heeft versleuteling en zelfvernietigende berichten. Gesynchroniseerd Telegram geeft je toegang tot je chats vanaf meerdere apparaten. Snel Telegram bezorgt berichten sneller dan iedere andere app. Krachtig Bij Telegram zijn de grootte van je media en chats onbegrensd. Open Telegram heeft een open API en broncode, gratis voor iedereen. Veilig Telegram beveiligt je berichten tegen aanvallen van hackers. Sociaal Telegram-groepen kunnen tot wel 200.000 leden hebben. Expressief Telegram laat je de chatapp volledig personaliseren. Telegram Telegram is een cloud-gebaseerde chatapp voor mobiel en desktop met een focus op veiligheid en snelheid. Over Veelgestelde vragen Blog Banen Mobiele apps iPhone/iPad Android Windows Phone Desktopapps PC/Mac/Linux macOS Webbrowser Platform API Vertalingen Snelle weergave;False
303;0000238;scribd.com;This website stores data such as cookies to enable essential site functionality, as well as marketing, personalization, and analytics. You may change your settings at any time or accept the default settings. Privacy Policy Marketing Personalization Analytics Save Accept All;True
304;0000239;google.fr;NL Inloggen Voordat je verdergaat naar Google Zoeken Google gebruikt cookies en gegevens voor het volgende: Services leveren en onderhouden (zoals uitval bijhouden en beschermen tegen spam, fraude en misbruik). Betrokkenheid van doelgroepen en sitestatistieken meten om inzicht te krijgen in hoe onze services worden gebruikt. Als je akkoord gaat, gebruiken we cookies en gegevens ook voor het volgende: De kwaliteit van onze services verbeteren en nieuwe services ontwikkelen. Advertenties laten zien en de effectiviteit ervan meten. Gepersonaliseerde content laten zien (afhankelijk van je instellingen). Gepersonaliseerde of algemene advertenties laten zien (afhankelijk van je instellingen) op Google en het web. Voor niet-gepersonaliseerde content en advertenties kan wat je te zien krijgt, worden beïnvloed door factoren zoals de content die je op dat moment bekijkt en je locatie (voor advertenties wordt je algemene locatie gebruikt). Gepersonaliseerde content en advertenties kunnen ook worden gebaseerd op die factoren maar ook op je activiteit zoals Google-zoekopdrachten en de video's die je bekijkt op YouTube. Gepersonaliseerde content en advertenties zijn bijvoorbeeld relevantere resultaten en aanbevelingen, een aangepaste YouTube-homepage en advertenties die op je interesses zijn afgestemd. Klik op Aanpassen om de opties te bekijken, waaronder beheermogelijkheden om het gebruik van cookies voor personalisatie te weigeren, en informatie over browseropties waarmee je sommige of alle cookies kunt weigeren voor ander gebruik. Je kunt ook op elk moment naar g.co/privacytools gaan. Privacy · Voorwaarden Aanpassen Ik ga akkoord;True
305;0000240;mysql.com;Uw beslissingen met betrekking tot cookies op deze site Door gebruik te maken van onze sites, stemt u ermee in dat Oracle en onze externe partners kunnen gebruikmaken van cookies en vergelijkbare technologieën om gebruikersgegevens te verzamelen voor de volgende doeleinden: Vereiste cookies zijn noodzakelijk voor de werking van de site, bijvoorbeeld om uw aanmeldingsgegevens te onthouden en een veilige aanmelding mogelijk te maken Met functionele cookies kunnen wij de site optimaliseren, bijvoorbeeld om statistieken te verzamelen, uw voorkeuren voor sociale interacties op te slaan of u in staat te stellen berichten op onze site te plaatsen Met reclamecookies kunnen Oracle en onze externe partners u in al uw browsers en op al uw apparaten reclame en gerichte content op basis van uw interesses aanbieden Lees ons privacybeleid voor meer informatie. Alles accepterenAlles weigerenCookievoorkeuren bekijken en wijzigen   Privacybeleid | Powered by;True
306;0000240;mysql.com;Products Cloud Services Partners Customers Why MySQL? News & Events How to Buy;False
307;0000242;pikirançrakyat.com;HEADLINE KOLOM Anak Diktator Korup Jadi Presiden di Filipina, Jangan Menular ke Indonesia;False
308;0000242;pikirançrakyat.com;BANDUNG RAYA JAWA BARAT NASIONAL INTERNASIONAL PERSIB BOLA OLAHRAGA PENDIDIKAN EKONOMI TEKNOLOGI ENTERTAINMENT GAYA HIDUP;False
309;0000243;independent.co.uk;Your privacy options We need your consent so that we and our trusted partners can store and access cookies, unique identifiers, personal data, and information on your browsing behaviour on this device. This only applies to independent.co.uk. You can change your preferences at any time by clicking on ‘Privacy options’ located at the bottom of any page. You don’t have to agree, but some personalised content and advertising may not work if you don’t. We and our partners use your data for the following purposes: Informatie op een apparaat opslaan en/of openen Cookies, apparaatidentificatoren of andere informatie kunnen op uw apparaat worden opgeslagen of geopend voor de doeleinden die aan u worden gepresenteerd. Gepersonaliseerde advertenties en inhoud, advertentie- en inhoudsmeting, doelgroep inzichten en productontwikkeling. Advertenties en content kunnen worden gepersonaliseerd op basis van een profiel. Meer gegevens kunnen worden toegevoegd om advertenties en content beter te personaliseren. Advertentie- en contentprestaties kunnen worden gemeten. Inzichten kunnen worden afgeleid over het publiek dat de advertenties en content heeft gezien. Gegevens kunnen worden gebruikt om gebruikerservaring, systemen en software te bouwen of te verbeteren. Precieze geolocatie gegevens en identificatie via het scannen van apparaten Precieze geolocatie en informatie over apparaat kenmerken kunnen worden gebruikt. To view our list of partners and see how your data may be used, click or tap ‘options’ below. You can also review where our partners claim a legitimate interest to use your data and, if you wish, object to them using it. OPTIONS AGREE;True
310;0000243;independent.co.uk;Subscribe LOGIN NEWS INDEPENDENT TV CLIMATE SPORT VOICES CULTURE TRAVEL INDY/ LIFE PREMIUM INDYBEST INDY100 VOUCHERS COMPARE;False
311;0000245;amzn.to;We're showing you items that ship to BE. To see items that ship to a different country, change your delivery address. Don't Change Change Address;False
312;0000245;amzn.to;Today's Deals Customer Service Registry Gift Cards Sell;False
313;0000245;amzn.to;Deliver to Belgium All All Departments Arts & Crafts Automotive Baby Beauty & Personal Care Books Boys' Fashion Computers Deals Digital Music Electronics Girls' Fashion Health & Household Home & Kitchen Industrial & Scientific Kindle Store Luggage Men's Fashion Movies & TV Music, CDs & Vinyl Pet Supplies Prime Video Software Sports & Outdoors Tools & Home Improvement Toys & Games Video Games Women's Fashion Hello, Sign in Account & Lists Returns & Orders 0 Cart;False
314;0000246;berkeley.edu;Students Faculty & Staff Parents Alumni Give Map Directory bConnected News About Admissions Academics Research Campus Life;False
315;0000247;addthis.com;Uw beslissingen met betrekking tot cookies op deze site By using our sites, AddThis and onze externe partners gebruikmaken van cookies en vergelijkbare technologieën om gebruikersgegevens in te zamelen voor de volgende doeleinden: vereiste cookies zijn noodzakelijk voor de werking van de site. Deze cookies worden bijvoorbeeld gebruikt voor het onthouden van uw gegevens en maken een veilige aanmelding mogelijk functionele cookies ondersteunen ons bij de optimalisering van de site. Deze cookies verzamelen bijvoorbeeld statistieken over uw voorkeuren voor sociale interacties, of stellen u in staat om berichten op onze site te plaatsen advertising cookies allow AddThis and our third party partners to provide you with interest-based advertising and tailored content across your browsers and devices Lees ons privacybeleid voor meer informatie. Ik aanvaard alle cookiesCookievoorkeuren bekijken en wijzigen   Privacybeleid | Aangeboden door;True
316;0000247;addthis.com;Share Buttons The easiest way to spread your content online. Get Started Learn More;False
317;0000248;squarespace.com;Squarespace Logo € EUR ↓  ENGLISH ↓ PRODUCTS WEBSITE TEMPLATES WEBSITES DOMAINS ONLINE STORES TOCK EXTENSIONS MARKETING TOOLS EMAIL MARKETING SCHEDULING SOCIAL MEDIA TOOLS PROFESSIONAL EMAIL LOGO MAKER PREMIUM SERVICES PRICING FEATURE LIST CUSTOMERS WEBSITE EXAMPLES FEATURED CUSTOMERS CREATORS BUSINESSES ONLINE STORES ETSY SELLERS RESTAURANTS ARTISTS BLOGGERS PHOTOGRAPHERS WEDDINGS ENTERPRISE STUDENTS COMPANY ABOUT CAREERS INVESTOR RELATIONS OUR BRAND AFFILIATES PRESS & MEDIA TERMS OF SERVICE PRIVACY POLICY SECURITY MEASURES CONTACT US IMPRINT COOKIE PREFERENCES COMMUNITY HELP CENTER HIRE AN EXPERT FORUM WEBINARS DEVELOPER PLATFORM PROFESSIONALS FOLLOW NEWSROOM SQUARESPACE BLOG ENGINEERING BLOG SERVICE STATUS INSTAGRAM YOUTUBE LINKEDIN FACEBOOK TWITTER;False
318;0000249;cnblogs.com;Nieuwe Gietijzeren Radiatoren Classic Comfort;False
319;0000250;liputan6.com;MASUK liputan6 CARI HOME NEWS RAMADAN QURAN BISNIS SAHAM SHOWBIZ CRYPTO FOTO TEKNO CEK FAKTA VIDEO HOT LAINNYA;False
320;0000250;liputan6.com;SAHAM Jalan Pintas untuk Tahu Cara Baca Candlestick dan Trading Lebih Mahir Pelajari cara membaca candlestick agar trading menjadi lebih mahir dan bisa mengambil keputusan lebih baik.;False
321;0000250;liputan6.com;JADWAL ACARA HARI INI LIVE FTV Siang 14:20 Biduan Dangdut Anti Galau 15:40 Pelangi Untuk Nirmala SELENGKAPNYA;False
