396;0000309;stackexchange.com;Tour About Us Meta Log in Stack Exchange All Sites Top Users Digests Stack Exchange Q&A communities are different. Here's how: Expert communities. Each of our 179 communities is built by people passionate about a focused topic. The right answer. Right on top. Experts like you can vote on posts, so the most helpful answers are easy to find. Share knowledge. Earn trust. Earn reputation and additional privileges for posts others find helpful. Learn more hot real-time  Is amateur research in mathematics viable? gm.general-mathematics 11 answers | asked yesterday by Nilav on mathoverflow Palindromic Powers code-golf number sequence arithmetic palindrome 9 answers | asked 11 hours ago by Number Basher on codegolf If Congress passed a bill written in Spanish, would it be valid? united-states congress 3 answers | asked yesterday by Someone on law What does sending weapons mean? armed-conflict ukraine weapons 5 answers | asked yesterday by Paul Erlenmeyer on politics Why did Lockhart seem threatened when Ron and Harry took him to the Chamber of Secrets? harry-potter 2 answers | asked 9 hours ago by Kyle V on scifi Why doesn’t NASA build their rockets out of graphene? rockets nasa design-alternative future-missions research 3 answers | asked yesterday by The Rocket fan on space Why would vampires sire vampires of lesser blood than they have to? society fantasy-races vampires urban-fantasy secret-society 11 answers | asked 2 days ago by Cyrus Drake on worldbuilding Bitwise XOR of floats code-golf binary floating-point 4 answers | asked 8 hours ago by Ovinus Real on codegolf Is the ferry between Changi, Singapore and Tanjung Belungkor, Malaysia currently running? ferries singapore malaysia 2 answers | asked 10 hours ago by hippietrail on travel 🇷🇴🇹🇩🇷🇴🇹🇩🇷🇴🇹🇩🇷🇴🇷🇴 🇷🇴🇹🇩🇷🇴🇷🇴🇷🇴🇹🇩🇷🇴🇷🇴 enigmatic-puzzle cipher flags 1 answers | asked 15 hours ago by wjandrea on puzzling When told "call sign only" in a frequency change, how to transmit it? air-traffic-control radio-communications phraseology 3 answers | asked yesterday by William Cat on aviation Make table whose width is more than the text width to center with `tabularray` in LaTeX? tables tabularray 4 answers | asked 10 hours ago by Y. zeng on tex How to manage time pressure? dnd-5e gm-techniques pacing 5 answers | asked yesterday by Groody the Hobgoblin on rpg Which software was the first to use copy protection? history floppy-disk cassette-tape copy-protection 2 answers | asked 22 hours ago by Micropolis on retrocomputing What is the meaning when the editor says a paper is "provocative"? publications journals paper-submission editors 5 answers | asked May 9 at 6:09 by dodo on academia Exit strategies for the Ukraine war russian-federation armed-conflict ukraine 4 answers | asked yesterday by Peter - Reinstate Monica on politics Why are typewriter keys referred to as “stops”, especially when compared to organ stops? meaning history historical-change 2 answers | asked yesterday by Puffafish on english Was Ukraine planning an attack in Donbas/Crimea prior to the 2022 Russian invasion of Ukraine? russia ukraine vladimir-putin russo-ukranian-war 4 answers | asked 2 days ago by Allure on skeptics Is it safe to ignore/override TLS warnings if user doesn't enter passwords or other data? tls web-browser 5 answers | asked yesterday by EJ Mak on security Can ransomware Embed itself in to a SQL Backup file sql-server sql-server-2016 security 3 answers | asked 14 hours ago by icecurtain on dba British "Unrigorous" Mathematics Work Prior To G.H. Hardy elementary-proofs 2 answers | asked yesterday by Trunk on mathoverflow Whose photos are carried by Vladimir Putin and those by his side in the May 9, 2022 Moscow Victory Day Parade and what are their significance? russian-federation history vladimir-putin symbols world-war-ii 2 answers | asked yesterday by uhoh on politics What is the single highest damage attack that can be made by one tenth level character with no assistance, support, or magic items? dnd-5e optimization 3 answers | asked 10 hours ago by user2754 on rpg What's the cheapest way to wire these lights that are 400' away at the end of the driveway? wiring 7 answers | asked 2 days ago by RetiredATC on diy Meaning of the phrase 'the way the meaning of things' meaning sentence-construction 5 answers | asked yesterday by Daniel Joseph on ell How would an adult artificial human behave after they exit the biofabricator? science-fiction fantasy-races genetic-engineering 12 answers | asked 2 days ago by Sabrine Crystal on worldbuilding Is it true that switching programming languages will have little impact on the scalability of a CRUD API? api performance scalability backend startup 9 answers | asked 2 days ago by Vincent on softwareengineering After buying from a brick & mortar shop they've contacted me to say buying things from them is consent to arbitration. Is this legal? united-states contract-law consumer-protection ohio arbitration 5 answers | asked May 9 at 3:16 by when squared equals a negative on law Should recommendation letters mention a candidate's weaknesses? recommendation-letter 4 answers | asked yesterday by avid on academia What is the connotation of “The Hitchhiker's Guide to XYZ”? meaning word-choice meaning-in-context 4 answers | asked 2 days ago by Qiulang 邱朗 on english 15 30 50 per page 1 2 3 4 next Today's Featured Site Project Management Stack Exchange Q&A for project managers 6.1k questions 19k answers 97% answered Top Network Askers Nilav MathOverflow Number Basher Code Golf Someone Law Paul Erlenmeyer Politics Kyle V Science Fiction & Fantasy The Rocket fan Space Exploration Cyrus Drake Worldbuilding Ovinus Real Code Golf hippietrail Travel wjandrea Puzzling William Cat Aviation Y. zeng TeX - LaTeX Groody the Hobgoblin Role-playing Games Micropolis Retrocomputing dodo Academia Peter - Reinstate Monica Politics Puffafish English Language & Usage Allure Skeptics EJ Mak Information Security icecurtain Database Administrators Trunk MathOverflow uhoh Politics user2754 Role-playing Games RetiredATC Home Improvement Daniel Joseph English Language Learners Sabrine Crystal Worldbuilding Vincent Software Engineering when squared equals a negative Law avid Academia Qiulang 邱朗 English Language & Usage Top Network Sites Stack Overflow Mathematics Super User Ask Ubuntu Server Fault Meta Stack Exchange Unix & Linux Stack Overflow на русском English Language & Usage TeX - LaTeX view all 179 sites » hot questions feed  STACK EXCHANGE About Contact Feedback COMPANY Stack Overflow Teams Advertising Collectives Talent Press Legal Privacy Policy Terms of Service Cookie Settings Cookie Policy STACK EXCHANGE NETWORK Technology Culture & recreation Life & arts Science Professional Business API Data Blog Facebook Twitter LinkedIn Instagram Site design / logo © 2022 Stack Exchange Inc. user contributions licensed under cc by-sa. rev 2022.5.12.42094;False
397;0000310;google.cn;google.com.hk 请收藏我们的网址 翻译 ©2011 - ICP证合字B2-20070004号;False
398;0000311;washington.edu;By choosing to continue to use this UW website, you agree to the UW's collection and use of personal information and non-personal information as described in this Online Privacy Statement.  YES, I AGREE NO, I DO NOT AGREE;True
399;0000311;washington.edu;University of Washington University of Washington Students Parents Faculty & Staff Alumni Quick Links;False
400;0000312;fiverr.com;One Small Step Please check the box below to access the site Don't worry - you're one click away from continuing your normal visit. We're dedicated to keeping Fiverr safe from malicious visitors. Something in your behavior has triggered our protection systems - we apologise for any inconvenience this process may have caused. Ad blocking or ad filtering software may interfere with our ability to identify you as human. Please exclude fiverr.com. Modifying your headers or user agent string may trigger some of our detection tools. Make sure you don't have any browser extensions tampering with those. Make sure JavaScript is enabled in your browser. If you're still having trouble accessing the site, please contact Customer Support;False
401;0000313;xhamster.com;Website Blocked xhamster.com To keep you secure online, access is blocked to websites categorized as Adult/Sexually Explicit. This setting can be changed in the Sophos Home Dashboard. Return to Previous Page;False
402;0000314;huffpost.com;We value your privacy We and our partners store and/or access information on a device, such as cookies and process personal data, such as unique identifiers and standard information sent by a device for personalised ads and content, ad and content measurement, and audience insights, as well as to develop and improve products. With your permission we and our partners may use precise geolocation data and identification through device scanning. You may click to consent to our and our partners’ processing as described above. Alternatively you may click to refuse to consent or access more detailed information and change your preferences before consenting. Please note that some processing of your personal data may not require your consent, but you have a right to object to such processing. Your preferences will apply to a group of websites. You can change your preferences at any time by returning to this site or visit our privacy policy. DISAGREE & EXIT MORE OPTIONS AGREE & EXIT;True
403;0000315;tandfonline.com;Accept We use cookies to improve your website experience. To learn about our use of cookies and how you can manage your cookie settings, please see our Cookie Policy. By closing this message, you are consenting to our use of cookies.;True
404;0000316;statcounter.com;Features Pricing Demo Try it for FREE! Log In Statcounter Understand your visitors the easy way. Try it for FREE! Trusted on over 2 million websites worldwide. Crucial insights for time–strapped business owners. Session Replay See how your visitors are really experiencing your website, where they’re getting stuck and why they're getting frustrated. Live Visitor Feed Watch a real-time, live feed of your visitors. See individual visitor's location and system stats and set alerts for important visitors. Analytics See how your website is doing at-a-glance. Track your traffic trends, highlight problems and discover new opportunities. Try Statcounter free for 30 days Free 30 day trial No credit card required Plans from €9 / month Try it for FREE! 1. Sign up Create your account and start your 30 day trial. 2. Insert the code You'll receive a small piece of code to insert on your website. 3. Get visitor insights! Understand your visitors and see why they aren't converting. Trusted on over 2 million websites worldwide. I have used Statcounter.com for many years. I wouldn't have a website without it. It's really easy to see the data and make decisions from it without having to be an expert. Adam Curtis Hoowla With Statcounter, we don't have to dig for what we want to see, and that has enabled us to react quickly to problems and take advantage of opportunities we may have otherwise missed. Chance Agrella Freerange Stock Statcounter gives us quick insights about our website that helps us increase our sales without the headache of trying to understand how analytics programs work. Oscar Helm HappyHealthy Works on your favourite platforms Tumblr Blogger WordPress Squarespace SmugMug Google Sites Weebly Wix GoDaddy Drupal Shopify Follow our step by step installation guides for over 70 platforms Product Features Pricing How It Works Our Customers Success Stories Demo Get the App Statcounter iOS App Statcounter Android App Statcounter Windows App Company Mission Press Releases Careers Legal Link To Us Global Stats Support Installation Using Statcounter FAQ User Forum API Contact Us Learning Center Search Engine Optimization Conversion Rate Optimization Blog Statcounter Blog © Statcounter 1999-2022.   All rights reserved. Statcounter on Facebook Statcounter on Twitter;False
405;0000317;nbcnews.com;RUSSIA-UKRAINE CONFLICTABORTION RIGHTSPLAN YOUR VOTECOVIDU.S. NEWSOPINION;False
406;0000317;nbcnews.com;The coronavirus pandemic OVERVIEW CASE HOTSPOTS HOSPITALIZATIONS U.S. Covid cases and deaths Data as of May 11, 4 p.m. ET ↑ 59.1% Cases, two-week change 80,648 Average daily Covid cases 82,334,435 Total confirmed cases ↑ 41.1% Deaths, two-week change 481 Average daily Covid deaths 1,002,848 Total confirmed deaths;False
407;0000318;ikea.com;This website uses cookies On our website we use technical, analytical, marketing and preference cookies. These are necessary for our site to work properly and to give us information about how our site is used. Fine by me, I accept Settings;True
408;0000319;cisco.com;Met cookies kunnen we uw gebruik van onze website optimaliseren. We gebruiken ook cookies van derden voor advertentie- en analysedoeleinden. Lees onze Privacyverklaring en Cookiekennisgeving voor meer informatie. Nee, cookie-instellingen bewerken Weigeren Accepteren;True
409;0000319;cisco.com;Products and Services Solutions Support Learn Explore Cisco Search;False
410;0000320;duckduckgo.com;About DuckDuckGo Ben je het zat om gevolgd te worden online? Wij kunnen helpen. Krijg naadloze privacy bescherming in je browser, gratis met één download: Privé Zoeken Blokkeer Trackers Site Encryptie DuckDuckGo toevoegen aan Chrome ★ ★ ★ ★ ★ Beoordeeld 4.4/5 Privacy bescherming voor elk apparaat Privacy voor Chrome Browse zoals altijd, en wij regelen de rest. We hebben onze zoekmachine, tracker blocker, en encryptie forceerder gebundeld in één Chrome extensie. Privé zoekmachine Zoek privé met onze app en extension, voeg privé web zoeken toe aan je favoriete browser, of zoek direct op duckduckgo.com. Privé Browser App Onze privé browser voor mobiel is uitgerust met onze zoekmachine, tracker blocker, encryptie forceerder, en meer. Beschikbaar op iOS & Android.;False
411;0000321;snapchat.com;Hi! We use cookies and similar technologies ("cookies"), including third-party cookies, on this website to help operate and improve your browsing experience, monitor performance, and for advertising purposes. For more information on how we use cookies and your cookie choices, see our Cookie Policy! By clicking "Accept Cookies" below, you are giving us consent to use all cookies, including non-essential cookies. You may decline all non-essential cookies by clicking the "X" to your right. Go to "Cookie Settings" or our Cookie Policy to change your cookie settings, and withdraw your consent at any time. Accept Cookies Cookie Settings;True
412;0000321;snapchat.com;Advertisers Creators Developers Snap AR Features Download;False
413;0000322;gmail.com;Inloggen Doorgaan naar Gmail E-mailadres of telefoonnummer E-mailadres vergeten? Niet jouw computer? Gebruik de gastmodus om privé in te loggen. Meer informatie Volgende Account maken ‪Nederlands‬ HelpPrivacyVoorwaarden;False
414;0000323;deviantart.com;We use cookies to enhance your experience, analyze site traffic, and for marketing purposes. Learn more Manage your personal settings. Accept;True
415;0000324;marriott.com;By clicking “Accept All”, you agree to the storing of cookies on your browser or device to enhance site navigation, analyse site usage, and deliver content and offers tailored to your interests. Rejecting any or all cookies could negatively affect your experiences with our digital properties. Reject All Accept All Cookies Settings;True
416;0000326;giphy.com;Our Cookie Policy GIPHY uses cookies to improve your user experience and analyze website traffic. By clicking “Agree & Close,” you consent to our usage of cookies as described more fully in our Privacy Policy, linked here. You can change your cookie settings at any time by clicking “Manage cookies" in our global navigation menu. View our partners Learn More → Agree and close;True
417;0000326;giphy.com;Reactions Entertainment Sports Stickers Artists UploadCreate Log in @username + tag to search within a verified channel Search all the GIFs and Stickers;False
418;0000327;aboutads.info;Skip to main content Make choices with participating companies under the DAA Principles Choices Español Main menu Learn Control Principles About the DAA YourAdChoices Gives You Control When you click on the YourAdChoices Icon, you get control over how information about your interests is used for relevant advertising. > Take Control with YourAdChoices > Put the YourAdChoices Icon to Work for You > What's Behind the YourAdChoices Icon > The Benefits of Relevant Advertising   Take Control with YourAdChoices Exercise choice on the Web for desktop and mobile or mobile apps—with one or more participating companies.   Learn More FAQ     Put the AdChoices Icon to Work for You Use the Icon to understand when information about your interests is being collected or used—and by which—companies.   Learn More   What's Behind the YourAdChoices Icon YourAdChoices is brought to you by the Digital Advertising Alliance (DAA). Find out about the DAA program's protections and how participating companies are held accountable.   Learn More The Benefits of Relevant Advertising Advertising based on your likely interests gives you more relevant ads and offers and helps pay for the online content and services you enjoy.   Learn More Privacy Policy   |   Terms of Use   |   About the DAA   |   For Businesses © 2022 Digital Advertising Alliance – All rights reserved. Back to Top;False
419;0000328;android.com;Google plaatst cookies om het verkeer op deze website te analyseren. Informatie over je gebruik van onze site wordt voor dat doel gedeeld met Google. Details bekijken. OK;True
420;0000328;android.com;VOOR ONTWIKKELAARS Hulpmiddelen voor ontwikkelaars Android Studio en SDK Android-opensourceproject VOOR BEDRIJVEN Enterprise-overzicht Beheer Beveiliging Inschrijven Werknemers Aanbevolen Zakelijke apparaten Hulpmiddelen Voor partners Oplossingengids VOOR DE PERS Android-blog Enterprise-blog Pershoek Android voor iedereen Contacteer ons persteam Hoe Google Play werkt HET ECOSYSTEEM Android Auto Android TV Wear OS by Google SUPPORT Overstappen vanaf iOS Helpcentrum van Android Android File Transfer Vind mijn apparaat Deelnemen aan gebruikersonderzoek Privacybeleid Languages         Dansk         Deutsch (Belgien)         Deutsch         English         English (Australia)         English (Belgium)         English (Canada)         English (Hong Kong)         English (India)         English (Philippines)         English (United Kingdom)         Español         Español (México)         Español (Estados Unidos)         Filipino         Français (Belgique)         Français         Indonesia         Italiano         Nederlands (België)         Nederlands         Norsk bokmål         Polski         Português (Brasil)         Português         Svenska         Tiếng việt         Türkçe         Русский         हिन्दी         ไทย         中文 (简体)         中文 (香港)         中文 (台灣)         日本語         한국어      Sommige functies en apparaten zijn mogelijk niet in alle landen beschikbaar. Afhankelijk van beschikbaarheid. De beschikbaarheid en sommige functies verschillen per OEM en/of apparaatfabrikant. Find Android on Twitter Find Android on Instagram Find Android on YouTube Find Android on Facebook Find Android on LinkedIn;False
421;0000328;android.com;Android Wat is Android? Android 12 Telefoons en tablets Bedrijven;False
422;0000328;android.com;Nieuwe manieren om op ontdekking te gaan met Android (Go-versie).;False
423;0000328;android.com;Geavanceerde beveiliging voor wie het echt nodig heeft.;False
424;0000329;mediafire.com;MediaFire asks for your consent to use your personal data to: perm_identity Personalised ads and content, ad and content measurement, audience insights and product development devices Store and/or access information on a device expand_more Learn more Your personal data will be processed and information from your device (cookies, unique identifiers, and other device data) may be stored by, accessed by and shared with third party vendors, or used specifically by this site or app. Some vendors may process your personal data on the basis of legitimate interest, which you can object to by managing your options below. Look for a link at the bottom of this page or in our privacy policy where you can withdraw consent. Consent Manage options;True
425;0000329;mediafire.com;MediaFire uses cookies to provide you with a personalized browsing experience. By continuing to use this site, you agree to our Privacy Policy.. Dismiss I Accept;True
426;0000330;linktr.ee;This site uses cookies for performance, analytics, and personalisation which helps us to improve our site and provide you with personalised content. You may choose to "Accept" the use of ALL cookies, "Reject" to refuse all but strictly necessary cookies or set "Cookie Preferences" to further manage your cookie selections. For more information please see ourCookie Notice. Cookie Preferences Reject Accept;True
427;0000331;oup.com;We use cookies to enhance your experience on our website. By clicking 'continue' or by continuing to use our website, you are agreeing to our use of cookies. You can change your cookie settings at any time. ContinueFind out more;True
428;0000332;rubiconproject.com;Rubicon Project is now Magnite. Visit us here to learn more. LEGAL STUFF While we transition Rubicon Project technology to Magnite, we’re continuing to serve ads from this domain. To opt out, please click here. You can also read Rubicon Project’s Privacy Policy and Terms & Conditions index. Copyright 2022 Magnite, Inc. All rights reserved;False
429;0000333;mailchi.mp;We use cookies to provide website functionality, to analyze traffic on our Mailchimp Sites, personalize content, serve targeted advertisements and to enable social media functionality. Our Cookie Statement provides more information and explains how to update your cookie settings. View our Cookie Statement. Cookie settings Reject all Accept all cookies;True
430;0000334;wikihow.com;We use cookies to make wikiHow great. By using our site, you agree to our cookie policy. Cookie Settings Okay;True
431;0000334;wikihow.com;X Join us in our mission For over a decade, we’ve been on a mission: to help everyone in the world learn how to do anything. Today, we’re asking that you join us. Any amount that you can contribute helps us to continue providing readers like you with trusted, accurate and up-to-date information. Please consider supporting our continued work with a contribution to wikiHow. Let’s do this!;False
432;0000336;amazon.ca;Best Sellers Deals Store Customer Service New Releases Prime Fashion Sell Electronics Home Books Toys & Games Gift Ideas Computers Health & Household Gift Cards;False
433;0000336;amazon.ca;.ca Hello Select your address All All Departments Alexa Skills Amazon Devices Amazon Warehouse Deals Apps & Games Audible Audiobooks Automotive Baby Beauty Books Clothing, Shoes & Jewelry    Women    Men    Girls    Boys    Baby Electronics Gift Cards Grocery Handmade Health & Personal Care Home & Kitchen Industrial & Scientific Kindle Store Luggage & Travel Gear Luxury Beauty Movies & TV Music Musical Instruments, Stage & Studio Office Products Patio, Lawn & Garden Pet Supplies Prime Video Smart Home Software Sports & Outdoors Subscribe & Save Tools & Home Improvement Toys & Games Video Games Hello, Sign in Account & Lists Returns & Orders 0 Cart;False
434;0000337;business.site;Tools, training en technologie om je bedrijf sterker te maken. + Meer informatie vind je hier;False
435;0000337;business.site;Bedrijfsprofiel Skip to content Overzicht Bedrijfsprofiel Veelgestelde vragen COVID-19 Inloggen Nu beheren;False
436;0000337;business.site;Grace’s 4,8 Kledingwinkel · Open Volgen OVERZICHT FOTO'S POSTS OVER BELLEN ROUTE BERICHT STUREN WEBSITE Grace’s is een luxueuze vrouwenkledingwinkel. NDSM-Plein 302, 1000 Bruxelles, Belgium 3,7 km • 10 min. per auto;False
437;0000340;pki.goog;Deze site gebruikt cookies van Google om services te leveren en verkeer te analyseren. Meer informatie OK;True
438;0000340;pki.goog;Trust Services Overview Repository FAQ and contact;False
439;0000341;usnews.com;By clicking “Agree,” you consent to our Terms and Conditions and Privacy Policy and the use of technologies such as cookies by U.S. News & World Report and third parties we work with to deliver relevant advertising on our site, in emails and across the Internet, personalize content and perform site analytics. Please visit our Privacy Policy for more information about our use of data and your rights. Please note that if you do not agree, you will not be able to access our site. Agree;True
440;0000342;pubmatic.com;About Cookies On This Site We use cookies to personalize and enhance your experience on our site. Visit our Privacy Policy to learn more or manage your personal preferences in our Cookie Consent Tool. By using our site, you agree to our use of cookies. Decline Accept Options;True
441;0000342;pubmatic.com;LOGIN SOLUTIONS PRODUCTS RESOURCES ABOUT CAREERS CONTACT;False
442;0000343;binance.com;Door op “Alle cookies accepteren” te klikken gaat u akkoord met het opslaan van cookies op uw apparaat voor het verbeteren van websitenavigatie, het analyseren van websitegebruik en om ons te helpen bij onze marketingprojecten. Cookie Policy Cookie-instellingen Alles afwijzen Alle cookies accepteren;True
