173;0000143;php.net;Downloads Documentation Get Involved Help  PHP is a popular general-purpose scripting language that is especially suited to web development. Fast, flexible and pragmatic, PHP powers everything from your blog to the most popular websites in the world. Download 8.1.5·Release Notes·Upgrading 8.0.19·Release Notes·Upgrading 7.4.29·Release Notes·Upgrading 12 May 2022 PHP 8.0.19 Released! The PHP development team announces the immediate availability of PHP 8.0.19. This is a bug fix release. All PHP 8.0 users are encouraged to upgrade to this version. For source downloads of PHP 8.0.19 please visit our downloads page, Windows source and binaries can be found on windows.php.net/download/. The list of changes is recorded in the ChangeLog. 15 Apr 2022 PHP 8.0.18 Released! The PHP development team announces the immediate availability of PHP 8.0.18. This is a bug fix release. All PHP 8.0 users are encouraged to upgrade to this version. For source downloads of PHP 8.0.18 please visit our downloads page, Windows source and binaries can be found on windows.php.net/download/. The list of changes is recorded in the ChangeLog. 14 Apr 2022 PHP 8.1.5 Released! The PHP development team announces the immediate availability of PHP 8.1.5. This is a bug fix release. All PHP 8.1 users are encouraged to upgrade to this version. For source downloads of PHP 8.1.5 please visit our downloads page, Windows source and binaries can be found on windows.php.net/download/. The list of changes is recorded in the ChangeLog. 14 Apr 2022 PHP 7.4.29 Released! The PHP development team announces the immediate availability of PHP 7.4.29. This is a security release for Windows users. This is primarily a release for Windows users due to necessarily upgrades to the OpenSSL and zlib dependencies in which security issues have been found. All PHP 7.4 on Windows users are encouraged to upgrade to this version. For source downloads of PHP 7.4.29 please visit our downloads page, Windows source and binaries can be found on windows.php.net/download/. The list of changes is recorded in the ChangeLog. 17 Mar 2022 PHP 8.1.4 Released! The PHP development team announces the immediate availability of PHP 8.1.4. This is a bug fix release. All PHP 8.1 users are encouraged to upgrade to this version. For source downloads of PHP 8.1.4 please visit our downloads page, Windows source and binaries can be found on windows.php.net/download/. The list of changes is recorded in the ChangeLog. 17 Mar 2022 PHP 8.0.17 Released! The PHP development team announces the immediate availability of PHP 8.0.17. This is a bug fix release. All PHP 8.0 users are encouraged to upgrade to this version. For source downloads of PHP 8.0.17 please visit our downloads page, Windows source and binaries can be found on windows.php.net/download/. The list of changes is recorded in the ChangeLog. 17 Feb 2022 PHP 8.1.3 Released! The PHP development team announces the immediate availability of PHP 8.1.3. This is a security release. All PHP 8.1 users are encouraged to upgrade to this version. For source downloads of PHP 8.1.3 please visit our downloads page, Windows source and binaries can be found on windows.php.net/download/. The list of changes is recorded in the ChangeLog. 17 Feb 2022 PHP 8.0.16 Released! The PHP development team announces the immediate availability of PHP 8.0.16. This is a security release. All PHP 8.0 users are encouraged to upgrade to this version. For source downloads of PHP 8.0.16 please visit our downloads page, Windows source and binaries can be found on windows.php.net/download/. The list of changes is recorded in the ChangeLog. 17 Feb 2022 PHP 7.4.28 Released! The PHP development team announces the immediate availability of PHP 7.4.28. This is a security release. All PHP 7.4 users are encouraged to upgrade to this version. For source downloads of PHP 7.4.28 please visit our downloads page, Windows source and binaries can be found on windows.php.net/download/. The list of changes is recorded in the ChangeLog. 21 Jan 2022 PHP 8.1.2 Released! The PHP development team announces the immediate availability of PHP 8.1.2. This is a bug fix release. All PHP 8.1 users are encouraged to upgrade to this version. For source downloads of PHP 8.1.2 please visit our downloads page, Windows source and binaries can be found on windows.php.net/download/. The list of changes is recorded in the ChangeLog. 20 Jan 2022 PHP 8.0.15 Released! The PHP development team announces the immediate availability of PHP 8.0.15. This is a bug fix release. All PHP 8.0 users are encouraged to upgrade to this version. For source downloads of PHP 8.0.15 please visit our downloads page, Windows source and binaries can be found on windows.php.net/download/. The list of changes is recorded in the ChangeLog. 17 Dec 2021 PHP 8.1.1 Released! The PHP development team announces the immediate availability of PHP 8.1.1. This is a bug fix release. All PHP 8.1 users are encouraged to upgrade to this version. For source downloads of PHP 8.1.1 please visit our downloads page, Windows source and binaries can be found on windows.php.net/download/. The list of changes is recorded in the ChangeLog. 16 Dec 2021 PHP 8.0.14 Released! The PHP development team announces the immediate availability of PHP 8.0.14. This is a bug fix release. All PHP 8.0 users are encouraged to upgrade to this version. For source downloads of PHP 8.0.14 please visit our downloads page, Windows source and binaries can be found on windows.php.net/download/. The list of changes is recorded in the ChangeLog. 16 Dec 2021 PHP 7.4.27 Released! The PHP development team announces the immediate availability of PHP 7.4.27. This is a bug fix release. All PHP 7.4 users are encouraged to upgrade to this version. For source downloads of PHP 7.4.27 please visit our downloads page, Windows source and binaries can be found on windows.php.net/download/. The list of changes is recorded in the ChangeLog. 25 Nov 2021 PHP 8.1.0 Released! The PHP development team announces the immediate availability of PHP 8.1.0. This release marks the latest minor release of the PHP language. PHP 8.1 comes with numerous improvements and new features such as: Enumerations Readonly properties Fibers Pure Intersection Types never return type First-class Callable Syntax "final" modifier for class constants New fsync and fdatasync functions New array_is_list function Explicit Octal numeral notation And much much more... Take a look at the PHP 8.1 Announcement Addendum for more information. For source downloads of PHP 8.1.0 please visit our downloads page, Windows source and binaries can be found on windows.php.net/download/. The list of changes is recorded in the ChangeLog. The migration guide is available in the PHP Manual. Please consult it for the detailed list of new features and backward incompatible changes. Many thanks to all the contributors and supporters! 22 Nov 2021 PHP Foundation Announced The PHP Foundation has been announced as an entity for funding the work of developing the PHP language. For more information regarding the structure and purpose of the foundation, please check out the blog post at: jetbrains.com. 19 Nov 2021 PHP 8.0.13 Released! The PHP development team announces the immediate availability of PHP 8.0.13. This is a security release. All PHP 8.0 users are encouraged to upgrade to this version. For source downloads of PHP 8.0.13 please visit our downloads page, Windows source and binaries can be found on windows.php.net/download/. The list of changes is recorded in the ChangeLog. 18 Nov 2021 PHP 7.3.33 Released! The PHP development team announces the immediate availability of PHP 7.3.33. This is a security release. All PHP 7.3 users are encouraged to upgrade to this version. For source downloads of PHP 7.3.33 please visit our downloads page, Windows source and binaries can be found on windows.php.net/download/. The list of changes is recorded in the ChangeLog. 18 Nov 2021 PHP 7.4.26 Released! The PHP development team announces the immediate availability of PHP 7.4.26. This is a security release. All PHP 7.4 users are encouraged to upgrade to this version. For source downloads of PHP 7.4.26 please visit our downloads page, Windows source and binaries can be found on windows.php.net/download/. The list of changes is recorded in the ChangeLog. 11 Nov 2021 PHP 8.1.0 RC 6 available for testing The PHP team is pleased to announce the release of PHP 8.1.0, RC 6. This is the sixth and final release candidate, continuing the PHP 8.1 release cycle, the rough outline of which is specified in the PHP Wiki. For source downloads of PHP 8.1.0, RC 6 please visit the download page. Please carefully test this version and report any issues found in the bug reporting system. Please DO NOT use this version in production, it is an early test version. For more information on the new features and other changes, you can read the NEWS file or the UPGRADING file for a complete list of upgrading notes. These files can also be found in the release archive. The next release will be the production-ready, general availability release, planned for 25 November 2021. The signatures for the release can be found in the manifest or on the QA site. Thank you for helping us make PHP better. 28 Oct 2021 PHP 8.1.0 RC 5 available for testing The PHP team is pleased to announce the release of PHP 8.1.0, RC 5. This is the fifth release candidate, continuing the PHP 8.1 release cycle, the rough outline of which is specified in the PHP Wiki. For source downloads of PHP 8.1.0, RC 5 please visit the download page. Please carefully test this version and report any issues found in the bug reporting system. Please DO NOT use this version in production, it is an early test version. For more information on the new features and other changes, you can read the NEWS file or the UPGRADING file for a complete list of upgrading notes. These files can also be found in the release archive. The next release will be the sixth and last release candidate (RC 6), planned for 11 November 2021. The signatures for the release can be found in the manifest or on the QA site. Thank you for helping us make PHP better. 28 Oct 2021 PHP 7.3.32 Released! The PHP development team announces the immediate availability of PHP 7.3.32. This is a security release. All PHP 7.3 FPM users are encouraged to upgrade to this version. For source downloads of PHP 7.3.32 please visit our downloads page, Windows source and binaries can be found on windows.php.net/download/. The list of changes is recorded in the ChangeLog. 22 Oct 2021 PHP 7.4.25 Released! The PHP development team announces the immediate availability of PHP 7.4.25. This is a security release. All PHP 7.4 users are encouraged to upgrade to this version. For source downloads of PHP 7.4.25 please visit our downloads page, Windows source and binaries can be found on windows.php.net/download/. The list of changes is recorded in the ChangeLog. 21 Oct 2021 PHP 8.0.12 Released! The PHP development team announces the immediate availability of PHP 8.0.12. This is a security fix release. All PHP 8.0 users are encouraged to upgrade to this version. For source downloads of PHP 8.0.12 please visit our downloads page, Windows source and binaries can be found on windows.php.net/download/. The list of changes is recorded in the ChangeLog. 14 Oct 2021 PHP 8.1.0 RC 4 available for testing The PHP team is pleased to announce the release of PHP 8.1.0, RC 4. This is the fourth release candidate, continuing the PHP 8.1 release cycle, the rough outline of which is specified in the PHP Wiki. For source downloads of PHP 8.1.0, RC 4 please visit the download page. Please carefully test this version and report any issues found in the bug reporting system. Please DO NOT use this version in production, it is an early test version. For more information on the new features and other changes, you can read the NEWS file or the UPGRADING file for a complete list of upgrading notes. These files can also be found in the release archive. The next release will be the fifth release candidate (RC 5), planned for 28 October 2021. The signatures for the release can be found in the manifest or on the QA site. Thank you for helping us make PHP better. Older News Entries Upcoming conferences CakeFest 2022: The Official CakePHP Conference Dutch PHP Conference 2022 - Schedule International PHP Conference Berlin 2022 PHP Russia 2022 User Group Events Special Thanks Social media @official_php Copyright © 2001-2022 The PHP Group My PHP.net Contact Other PHP.net sites Privacy policy View Source;False
174;0000144;windows.com;We gebruiken optionele cookies om je ervaring op onze websites te verbeteren, zoals via verbindingen op social media, en om gepersonaliseerde advertenties weer te geven op basis van je online activiteiten. Als je optionele cookies afwijst, worden alleen cookies gebruikt die nodig zijn om je de services te kunnen leveren. Je kunt je keus wijzigen door onderaan de pagina op 'Cookies beheren' te klikken.Privacyverklaring Cookies van derden Accepteren Weigeren Cookies beheren;True
175;0000145;blogger.com;.st0 { fill: url(#gradientone). } .st1 { fill: #FFFFFF. } .st2 { fill: url(#gradienttwo). } INLOGGEN;False
176;0000145;blogger.com;Zet je gedachten online zoals jij dat wilt Maak makkelijk een unieke, prachtige blog. JE EIGEN BLOG MAKEN;False
177;0000145;blogger.com;Kies het perfecte ontwerp Maak een prachtige blog die bij je stijl past. Kies uit verschillende gebruiksvriendelijke templates (allemaal met flexibele opmaak en honderden achtergrondafbeeldingen) of ontwerp zelf iets bijzonders.;False
178;0000145;blogger.com;Regel een domein Geef je blog de perfecte thuisbasis: vraag een domein op blogspot.com aan of koop in een paar klikken een eigen domein.;False
179;0000145;blogger.com;Verdien geld met je blog Laat je betalen voor je inspanning. Google AdSense kan automatisch relevante, getargete advertenties op je blog laten zien, zodat je inkomsten kunt genereren door over je interesses te bloggen.;False
180;0000145;blogger.com;Ken je publiek Ontdek met de ingebouwde analysefunctie van Blogger welke blogposts populair zijn. Je ziet waar je publiek vandaan komt en waarin mensen geïnteresseerd zijn. Je kunt je blog zelfs rechtstreeks aan Google Analytics koppelen voor meer gedetailleerde inzichten.;False
181;0000145;blogger.com;Bewaar je herinneringen Bewaar belangrijke momenten: met Blogger kun je duizenden blogposts, foto's en meer opslaan via Google.;False
182;0000145;blogger.com;Voeg je bij miljoenen anderen Ongeacht of je je expertise deelt, belangrijk nieuws bekendmaakt of je mening geeft: op Blogger ben je in goed gezelschap. Meld je aan en ontdek waarom miljoenen mensen hier over hun interesses bloggen. JE EIGEN BLOG MAKEN;False
183;0000145;blogger.com;Help Helpcentrum Helpforum Videohandleidingen Community Blogger Buzz Ontwikkelaars Blogger API Forum voor ontwikkelaars Servicevoorwaarden Privacy Inhoudsbeleid Afrikaans Amharic - አማርኛ Arabic - العربية Basque - euskara Bengali - বাংলা Bulgarian - български Catalan - ‪Català‬ Chinese (Hong Kong) - 中文（香港) Chinese (Simplified) - ‪简体中文‬ Chinese (Traditional) - 繁體中文 Croatian - Hrvatski Czech - Čeština Danish - Dansk Dutch - Nederlands English English (United Kingdom) Estonian - eesti Filipino Finnish - Suomi French (Canada) - Français (Canada) French (France) - Français (France) Galician - galego German - Deutsch Greek - Ελληνικά Gujarati - ગુજરાતી Hebrew - עברית Hindi - हिन्दी Hungarian - magyar Icelandic - íslenska Indonesian - Indonesia Italian - Italiano Japanese - 日本語 Kannada - ಕನ್ನಡ Korean - 한국어 Latvian - latviešu Lithuanian - lietuvių Malay - Bahasa Melayu Malayalam - മലയാളം Marathi - मराठी Norwegian - norsk Persian - فارسی Polish - polski Portuguese (Brazil) - Português (Brasil) Portuguese (Portugal) - português (Portugal) Romanian - română Russian - Русский Serbian - српски Slovak - Slovenčina Slovenian - slovenščina Spanish (Latin America) - Español (Latinoamérica) Spanish (Spain) - Español (España) Swahili - Kiswahili Swedish - Svenska Tamil - தமிழ் Telugu - తెలుగు Thai - ไทย Turkish - Türkçe Ukrainian - Українська Urdu - اردو Vietnamese - Tiếng Việt Zulu - isiZulu;False
184;0000146;google.de;NL Inloggen Voordat je verdergaat naar Google Zoeken Google gebruikt cookies en gegevens voor het volgende: Services leveren en onderhouden (zoals uitval bijhouden en beschermen tegen spam, fraude en misbruik). Betrokkenheid van doelgroepen en sitestatistieken meten om inzicht te krijgen in hoe onze services worden gebruikt. Als je akkoord gaat, gebruiken we cookies en gegevens ook voor het volgende: De kwaliteit van onze services verbeteren en nieuwe services ontwikkelen. Advertenties laten zien en de effectiviteit ervan meten. Gepersonaliseerde content laten zien (afhankelijk van je instellingen). Gepersonaliseerde of algemene advertenties laten zien (afhankelijk van je instellingen) op Google en het web. Voor niet-gepersonaliseerde content en advertenties kan wat je te zien krijgt, worden beïnvloed door factoren zoals de content die je op dat moment bekijkt en je locatie (voor advertenties wordt je algemene locatie gebruikt). Gepersonaliseerde content en advertenties kunnen ook worden gebaseerd op die factoren maar ook op je activiteit zoals Google-zoekopdrachten en de video's die je bekijkt op YouTube. Gepersonaliseerde content en advertenties zijn bijvoorbeeld relevantere resultaten en aanbevelingen, een aangepaste YouTube-homepage en advertenties die op je interesses zijn afgestemd. Klik op Aanpassen om de opties te bekijken, waaronder beheermogelijkheden om het gebruik van cookies voor personalisatie te weigeren, en informatie over browseropties waarmee je sommige of alle cookies kunt weigeren voor ander gebruik. Je kunt ook op elk moment naar g.co/privacytools gaan. Privacy · Voorwaarden Aanpassen Ik ga akkoord;True
185;0000148;mit.edu;Massachusetts Institute of Technology Education Research Innovation Admissions + Aid Campus Life News Alumni About MIT Search;False
186;0000148;mit.edu;Top resources for prospective students current students faculty & staff alumni parents Covid-19 and MIT all resources;False
187;0000148;mit.edu;Join us in building a better world. Massachusetts Institute of Technology 77 Massachusetts Avenue, Cambridge, MA, USA Visit Map Events People Careers Contact Privacy Accessibility Social Media Hub;False
188;0000149;wp.com;Wij en onze partners verwerken je persoonlijke gegevens (zoals browsegegevens, IP-adressen, cookie-informatie en andere unieke identificatiecodes) op basis van je toestemming en/of onze rechtmatige belangen voor het optimaliseren van onze website, marketingactiviteiten en je gebruikerservaring. Aanpassen Alles accepteren;True
189;0000149;wp.com;AAN DE SLAG Registreren Inloggen Abonnementen en prijzen PRODUCTEN WordPress Hosting Domeinnamen Websitebouwer Maak een blog aan Professionele e-mail P2: WordPress voor teams Enterprise MOGELIJKHEDEN Overzicht WordPress-thema’s WordPress-plugins Google Apps HULPMIDDELEN WordPress.com Ondersteuning Nieuws Tips bouwen van websites Bedrijfsnaamgenerator Logo maker Dagelijkse webinars WordPress cursussen;False
190;0000149;wp.com;WordPress.com Producten Mogelijkheden Hulpmiddelen Abonnementen en prijzen Inloggen Aan de slag;False
191;0000150;researchgate.net;We value your privacy We and our partners store and/or access information on a device, such as cookies and process personal data, such as unique identifiers and standard information sent by a device for personalised ads and content, ad and content measurement, and audience insights, as well as to develop and improve products. With your permission we and our partners may use precise geolocation data and identification through device scanning. You may click to consent to our and our partners’ processing as described above. Alternatively you may click to refuse to consent or access more detailed information and change your preferences before consenting. Please note that some processing of your personal data may not require your consent, but you have a right to object to such processing. Your preferences will apply to a group of websites. You can change your preferences at any time by returning to this site or visit our privacy policy. DISAGREE MORE OPTIONS AGREE;True
192;0000150;researchgate.net;Discover scientific knowledge and stay connected to the world of science Join for free;False
193;0000151;slideshare.net;SlideShare uses cookies to improve functionality and performance, and to provide you with relevant advertising. If you continue browsing the site, you agree to the use of cookies on this website. See our Privacy Policy and User Agreement for details. Home Explore Submit Search Upload Login Signup Discover. Share. Learn. Share what you know and love through presentations, infographics, documents and more Today’s Top SlideShares accenture Accenture Tech Vision 2020 - Trend 1 2,469,558 views Like Accenture Tech Vision 2020 - Trend 1 SlideShare. Save Accenture Tech Vision 2020 - Trend 1 SlideShare. Share Accenture Tech Vision 2020 - Trend 1 SlideShare. SlideShare SlideShare is joining Scribd 1,943,539 views Like SlideShare is joining Scribd SlideShare. Share SlideShare is joining Scribd SlideShare. DataReportal Digital 2020 Global Digital Overview (January 2020) v01 9,878,150 views Like Digital 2020 Global Digital Overview (January 2020) v01 SlideShare. Save Digital 2020 Global Digital Overview (January 2020) v01 SlideShare. Share Digital 2020 Global Digital Overview (January 2020) v01 SlideShare. Featured SlideShares See All SlideShare What to Upload to SlideShare 6y ago, 14,026,043 views Like What to Upload to SlideShare SlideShare. Save What to Upload to SlideShare SlideShare. Share What to Upload to SlideShare SlideShare. Adam Nash Be A Great Product Leader (Amplify, Oct 2019) 2y ago, 2,069,176 views Like Be A Great Product Leader (Amplify, Oct 2019) SlideShare. Share Be A Great Product Leader (Amplify, Oct 2019) SlideShare. Eric Schmidt Trillion Dollar Coach Book (Bill Campbell) 3y ago, 1,922,466 views Like Trillion Dollar Coach Book (Bill Campbell) SlideShare. Save Trillion Dollar Coach Book (Bill Campbell) SlideShare. Share Trillion Dollar Coach Book (Bill Campbell) SlideShare. apidays Every company is now a tech company. API's can help stay competitive 2y ago, 2,612,868 views Like Every company is now a tech company. API's can help stay competitive SlideShare. Save Every company is now a tech company. API's can help stay competitive SlideShare. Share Every company is now a tech company. API's can help stay competitive SlideShare. Wim Vanderbauwhede A few thoughts on work life-balance 2y ago, 1,812,718 views Like A few thoughts on work life-balance SlideShare. Save A few thoughts on work life-balance SlideShare. Share A few thoughts on work life-balance SlideShare. Mark Suster Is vc still a thing final 3y ago, 1,626,886 views Like Is vc still a thing final SlideShare. Save Is vc still a thing final SlideShare. Share Is vc still a thing final SlideShare. Gary Vaynerchuk The GaryVee Content Model 3y ago, 1,635,174 views Like The GaryVee Content Model SlideShare. Save The GaryVee Content Model SlideShare. Share The GaryVee Content Model SlideShare. Browse SlideShares:  a b c d e f g h i j k l m n o p q r s t u v w x y z 0 1 2 3 4 5 6 7 8 9 - About Support Terms Privacy Copyright English © 2022 SlideShare from Scribd;False
194;0000152;imgur.com;We value your privacy We and our partners store and/or access information on a device, such as cookies and process personal data, such as unique identifiers and standard information sent by a device for personalised ads and content, ad and content measurement, and audience insights, as well as to develop and improve products. With your permission we and our partners may use precise geolocation data and identification through device scanning. You may click to consent to our and our partners’ processing as described above. Alternatively you may click to refuse to consent or access more detailed information and change your preferences before consenting. Please note that some processing of your personal data may not require your consent, but you have a right to object to such processing. Your preferences will apply to this website only. You can change your preferences at any time by returning to this site or visit our privacy policy. DISAGREE MORE OPTIONS AGREE;True
195;0000152;imgur.com;New post Comment Leaderboard Go Ad-Free Sign in Sign up;False
196;0000154;amazon.co.uk;We ship internationally We're showing you items that ship to BE. To see items that are shipped to a different country, change your delivery address. CONTINUE CHANGE THE ADDRESS;False
